{
  "$schema": "../../schema/algorithm.schema.json",
  "method": "cfop",
  "stage": "2loll",
  "stage_name": "Two-Look OLL",
  "puzzle": "3x3",
  "notation": "wca-singmaster",
  "description": "Beginner-friendly subset of OLL that splits last-layer orientation into two steps: first orient all U-face edges with one of three setup algorithms (OELL: dot, line, L), then orient the corners (OCLL) given edges are already oriented. 9 algorithms total versus 57 for full OLL.",
  "cases": [
    {
      "id": "oell-dot",
      "name": "Dot",
      "aliases": ["No Edges Oriented", "OELL Dot"],
      "group": "oell",
      "tags": ["2loll", "oell"],
      "view": "u-only",
      "number": 1,
      "recognition": "U face shows the cross color on the center only; all 4 edges have the cross color on a side face.",
      "algorithms": [
        {
          "moves": "F (R U R' U') F' f (R U R' U') f'",
          "popularity": "primary",
          "popularity_rank": 1,
          "popularity_source": "ubiquitous beginner curriculum",
          "best_for": ["beginner", "two-handed"],
          "notes": "Standard two-look dot solver: F-sexy-F' followed by f-sexy-f' (wide-F variant) skips the L case in one go."
        },
        {
          "moves": "f (R U R' U') f' F (R U R' U') F'",
          "popularity": "common",
          "popularity_rank": 2,
          "notes": "Same idea with the wide-F portion first."
        }
      ]
    },
    {
      "id": "oell-l",
      "name": "L Shape",
      "aliases": ["Bar", "OELL L", "Adjacent Edges"],
      "group": "oell",
      "tags": ["2loll", "oell"],
      "view": "u-only",
      "number": 2,
      "recognition": "Two adjacent edges have the cross color on the U face, forming an L with the center (also known as a 'bar').",
      "algorithms": [
        {
          "moves": "f (R U R' U') f'",
          "popularity": "primary",
          "popularity_rank": 1,
          "popularity_source": "ubiquitous beginner curriculum",
          "best_for": ["beginner", "two-handed"],
          "notes": "Hold the L in the back-left, then wide-F sexy wide-F'."
        },
        {
          "moves": "F U R U' R' F'",
          "popularity": "common",
          "popularity_rank": 2,
          "notes": "Alternative grip that avoids the wide move."
        }
      ]
    },
    {
      "id": "oell-line",
      "name": "Line",
      "aliases": ["Bar", "OELL Line", "Opposite Edges"],
      "group": "oell",
      "tags": ["2loll", "oell"],
      "view": "u-only",
      "number": 3,
      "recognition": "Two opposite edges have the cross color on the U face, forming a horizontal line through the center.",
      "algorithms": [
        {
          "moves": "F (R U R' U') F'",
          "popularity": "primary",
          "popularity_rank": 1,
          "popularity_source": "ubiquitous beginner curriculum",
          "best_for": ["beginner", "two-handed"],
          "notes": "Hold the line horizontally (left-to-right), then F sexy F'."
        }
      ]
    },
    {
      "id": "ocll-sune",
      "name": "Sune",
      "aliases": ["OLL 27", "OCLL Sune"],
      "group": "ocll",
      "tags": ["2loll", "ocll"],
      "number": 4,
      "recognition": "One corner shows the cross color on top (positioned front-left). Looks like a fish.",
      "algorithms": [
        {
          "moves": "R U R' U R U2 R'",
          "popularity": "primary",
          "popularity_rank": 1,
          "popularity_source": "ubiquitous beginner curriculum",
          "best_for": ["beginner", "two-handed", "one-handed-right"],
          "notes": "The Sune. RUR'-URU2R'. One of the most iconic speedcubing algs."
        },
        {
          "moves": "L' U' L U' L' U2 L",
          "popularity": "common",
          "popularity_rank": 2,
          "best_for": ["one-handed-left"],
          "notes": "Left-handed mirror."
        }
      ]
    },
    {
      "id": "ocll-anti-sune",
      "name": "Anti-Sune",
      "aliases": ["OLL 26", "OCLL Anti-Sune"],
      "group": "ocll",
      "tags": ["2loll", "ocll"],
      "number": 5,
      "recognition": "One corner shows the cross color on top (positioned front-right). The mirror of Sune.",
      "algorithms": [
        {
          "moves": "R U2 R' U' R U' R'",
          "popularity": "primary",
          "popularity_rank": 1,
          "popularity_source": "ubiquitous beginner curriculum",
          "best_for": ["beginner", "two-handed"]
        },
        {
          "moves": "L' U2 L U L' U L",
          "popularity": "common",
          "popularity_rank": 2,
          "best_for": ["one-handed-left"]
        }
      ]
    },
    {
      "id": "ocll-h",
      "name": "H",
      "aliases": ["OLL 21", "OCLL H", "Double Sune"],
      "group": "ocll",
      "tags": ["2loll", "ocll"],
      "number": 6,
      "recognition": "Two opposite corners need to twist clockwise, two need to twist counter-clockwise. All 4 corners look 'wrong'.",
      "algorithms": [
        {
          "moves": "R U R' U R U' R' U R U2 R'",
          "popularity": "primary",
          "popularity_rank": 1,
          "popularity_source": "ubiquitous beginner curriculum",
          "best_for": ["beginner", "two-handed"],
          "notes": "Often called 'double Sune' because it resembles Sune-then-Sune."
        },
        {
          "moves": "F (R U R' U')3 F'",
          "popularity": "common",
          "popularity_rank": 2,
          "notes": "Mnemonic-friendly: F, sexy x3, F'."
        }
      ]
    },
    {
      "id": "ocll-pi",
      "name": "Pi",
      "aliases": ["OLL 22", "OCLL Pi", "Bruno"],
      "group": "ocll",
      "tags": ["2loll", "ocll"],
      "number": 7,
      "recognition": "Two adjacent corners need to twist one way, two adjacent corners need to twist the other way. Resembles the Greek letter Pi.",
      "algorithms": [
        {
          "moves": "R U2 R2 U' R2 U' R2 U2 R",
          "popularity": "primary",
          "popularity_rank": 1,
          "popularity_source": "ubiquitous beginner curriculum",
          "best_for": ["beginner", "two-handed"]
        },
        {
          "moves": "f (R U R' U') f' F (R U R' U') F'",
          "popularity": "common",
          "popularity_rank": 2,
          "notes": "Two-step approach: solves Pi as L-then-Line."
        }
      ]
    },
    {
      "id": "ocll-u",
      "name": "U",
      "aliases": ["OLL 23", "OCLL U", "Headlights"],
      "group": "ocll",
      "tags": ["2loll", "ocll"],
      "number": 8,
      "recognition": "Two adjacent corners are correct ('headlights') and the other two need to swap orientations.",
      "algorithms": [
        {
          "moves": "R2 D R' U2 R D' R' U2 R'",
          "popularity": "primary",
          "popularity_rank": 1,
          "popularity_source": "ubiquitous beginner curriculum",
          "best_for": ["beginner", "two-handed"],
          "notes": "Hold the headlights on the back; the other two corners are at the front."
        },
        {
          "moves": "F (R U R' U')3 F'",
          "popularity": "alternative",
          "popularity_rank": 3,
          "notes": "Also works since 3x sexy + F-conjugate solves multiple OCLL cases."
        }
      ]
    },
    {
      "id": "ocll-l",
      "name": "L",
      "aliases": ["OLL 25", "OCLL L", "Bowtie"],
      "group": "ocll",
      "tags": ["2loll", "ocll"],
      "number": 9,
      "recognition": "Two diagonally opposite corners are correct; the other two need to swap orientations the opposite direction from the T case.",
      "algorithms": [
        {
          "moves": "F' r U R' U' r' F R",
          "popularity": "primary",
          "popularity_rank": 1,
          "popularity_source": "ubiquitous beginner curriculum",
          "best_for": ["beginner", "two-handed"]
        },
        {
          "moves": "R' F' L F R F' L' F",
          "popularity": "common",
          "popularity_rank": 2,
          "notes": "Symmetric variant some prefer; involves an L move."
        },
        {
          "moves": "x R' U R D' R' U' R D x'",
          "popularity": "alternative",
          "popularity_rank": 3,
          "notes": "Commutator form."
        }
      ]
    }
  ]
}
